"SteamID","Ulasan","Status"
"76561198062015377","This game taught me about the diversity of cultures that our small little corner of the universe offers.  Then it taught me to hate them all.","baik"
"76561198438294956","This game is like an abusive ex. You know the relationship you have with them is toxic but you keep coming back thinking that this time would be different.","baik"
"76561198058437603","If you've ever wanted to age 40 years in a weekend, cry in three different emotional languages, and question your life choices every 15 minutes, congratulations — Dota 2 is your soulmate and your captor.    The game is ""free to play,"" which is ironic, because you pay with your soul. The tutorial tells you it's a strategy game, but what it fails to mention is that your biggest opponent is your own teammates. Playing Dota is like being in a hostage situation where you're also one of the kidnappers.    The matchmaking system is powered by an advanced AI that matches you with people who have either just installed the game, or just escaped a mental institution. Sometimes both. Balance? Oh, you mean the illusion of hope?    You'll find yourself saying things like:    “Why is Techies in my game again?”    “Why is the support farming mid?”    “Why am I still playing this?”    Each match starts with optimism and ends with depression, kind of like birthdays after you turn 30.    Let’s talk about toxicity. Dota 2 doesn’t have toxic players. No, that would be too simple. It has biohazard waste in voice chat. The kind of people who will ping your death three times, call you slurs in three languages, then proceed to die alone in the forest for 40 minutes.    The worst part? You’ll love it. Because winning in Dota 2 is like finding meaning in your life — rare, euphoric, and followed by a crushing loss that resets you back to reality.    In summary:  Dota 2 is the best worst thing to ever happen to me. It’s like Stockholm Syndrome with patch notes. 10/10 would uninstall and reinstall again out of pure spite.","baik"
"76561199716640512","The game is wonderful and very kind to beginners... While they are in the menu.  The community is not only positive, but also has telepathic skills. They told me that my dad wasn't really my dad, and my mom wasn't working where I thought she was.  Also, one of the advantages is that there are many doctors playing Dota 2 and they can easily diagnose your mental and physical abilities.","baik"
"76561199528783285","Отличная игра в которой тебе всё расскажут и даже не только про игру! Ты узнаешь о необычных работах своих родственников, о том насколько много людей любит и обожает твою маму. Также один из плюсов это большой выбор героев с не сложным управлением. Например Invoker очень легкий персонаж с кучей урона подходящий для поднятия рейтинга. Комьюнити очень хорошее, иногда встречаются игроки которые настолько хорошо играют, что ломают все свои вещи и собирают новые так как хотят дать фору врагам. Также разработчики очень усердно работают над обновлениями которые выходят раз в полгода и выпускаются для того чтобы онлайн повысился с 10 человек до 11 ( при этом в игру зашел сам разработчик). Ну в целом плюсы перечислять можно долго, а вот насчет минусов, их нет. Спасибо за внимание, надеюсь этот отзыв поможет читающим!","baik"
"76561198930930471","I installed Dota 2 thinking it was a game. It’s not. It’s a federally approved psychological warfare simulator disguised as entertainment. My first match lasted 72 emotional years. Somewhere between getting flamed for buying boots and being called a “walking ward,” I felt my hair detach from my soul and leave my scalp. By the 30-minute mark, I had gray strands, hand tremors, and a newfound respect for war veterans. My carry told me to uninstall, my support told me to die, and the enemy Sniper shot me from another dimension just to remind me I was never safe. When it was finally over, I just sat there in silence, staring into the void, wondering if I’d ever feel joy again. 11/10, would suffer again.","baik"
"76561198984597300","[b]I’m writing this review instead of clicking the 'Find Match' button, which probably tells you all you need to know about the current state of my mental health. I have nearly 2,000 hours in this game, and I've somehow spent 66 of those hours in the last two weeks alone. I don’t play Dota 2 because it’s fun I play it because it's a crippling addiction disguised as a highly complex and deeply rewarding video game.  The complexity is the main selling point and the main reason you'll hate your life. This isn't a game you can just pick up. The tutorial is basically just a gentle suggestion to prepare for a lifetime of disappointment. You'll spend your first 100 hours thinking you're getting good, your next 500 realizing you know nothing, and the following 1,400 hours trying to convince your teammates to buy a simple Town Portal Scroll. Seriously, I could write an entire thesis on the existential dread that comes with seeing a key item on the ground for 15 minutes while your carry walks past it.  Despite all the soul-crcrushing toxicity, the constant balance changes, and the feeling that every loss is personally your fault, there is no greater rush in gaming than successfully executing a complicated team-fight play, especially when you are playing a hero nobody expected to work. It’s a beautifully designed, competitive, constantly evolving monster that will steal your time, ruin your sleep schedule, and give you high blood pressure. But hey, it's free, and all 120+ heroes are available right from the start, so at least your financial advisor can't complain. Just do yourself a favor: mute all chat and try to remember to blink before you're stunned.[/b]","baik"
"76561198106503136","I only played this because League of Legends put me in timeout for telling a 13-year-old jungler to uninstall their soul.    Let me set the scene: it was a dark, shameful day. Riot Games had finally pulled the plug on my main account after a small misunderstanding involving ten ping spams, three racial slurs (none mine!), and one elo-defining loss. So what did I do? Reflect? Seek therapy? Touch grass?    No. I rebounded hard—straight into the open, masochistic arms of Dota 2.    And let me tell you: it was like crawling out of a frat house fight pit and stumbling into a sadistic chess tournament being played by Russian AIs with gambling addictions. This isn’t a game. It’s a graduate-level course in suffering, delivered exclusively through slurs, spreadsheets, and a mini-map that actively gaslights you.    You think League is toxic? Dota 2 players don’t flame you—they curse your bloodline. A Peruvian witch doctor once told me to feed my courier to Roshan and then die in real life. I didn’t even know what a courier was yet. Beautiful.    The learning curve? Imagine climbing Mount Everest, but it's vertical, on fire, and halfway up someone throws a techies minefield at your crotch. Every character has 42 active abilities, a secret satanic pact, and a passive-aggressive Reddit community explaining why you're doing it all wrong. There’s no “meta”—there’s only pain, and ten dudes yelling in five languages about “item timings” while your tower disintegrates like your self-esteem.    But oh, the complexity. The strategy. The high you get from landing a five-man black hole or denying a creep like a smug little Victorian landlord. I once got a triple kill with a flaming horseman while being coached mid-game by a Russian with a drinking problem and a heart of gold. It was the most bonding I’ve experienced since my parents’ divorce.    And the graphics? It looks like a Warhammer figurine collection got possessed by Satan and reanimated using Valve’s leftover Half-Life particles. Every match feels like a beautiful fever dream inside a burning cathedral.    Final Thoughts:  Dota 2 is the game you play when you’ve hit rock bottom in League and decided to dig deeper. It doesn’t hold your hand. It rips your hand off, feeds it to a jungle creep, and then blames you for feeding. It’s brutal, exhilarating, and almost certainly responsible for 12% of global blood pressure medication sales.    I came here because I was banned.  I stayed because the voices in my head said ""GLHF.""    10/10. Would flame myself again.","baik"
"76561198080449788","Dota 2 is like a toxic relationship—you hate it, you love it, you can’t quit it. One minute you’re outplaying opponents like a grandmaster, the next you’re getting flamed by a 12-year-old playing Techies. The learning curve? More like a learning cliff. But once you get hooked, there’s no escape.  The gameplay is deep, the heroes are diverse, and every match feels like a new disaster (or masterpiece). Just remember: if you win, it’s all skill. If you lose? Obviously, your team’s fault.  10/10 – Would feed mid again.","baik"
"76561198851298885","There is nothing tidy about a great Dota match. It’s a plan written in pencil while the table shakes. You queue for one game before bed and somehow you’re counting Roshan minutes at two in the morning, telling yourself that one good smoke can still turn it.  My favorite memory isn’t a rampage or a rapier flip. It’s the quiet after we botched a mid fight, when our offlaner typed “my bad,” pinged a smoke, and cut through the triangle without another word. We wrapped around, took vision, found a single pick, and the whole map felt different. That’s the Dota I love: it breaks you down and then hands you the tools to rebuild if you keep your head.  The design feels honest in a way competitive games rarely do. Every advantage has a window you can actually spot. Every mistake leaves a footprint you can learn from. Neutral items nudge priorities without erasing identity. Buybacks are terrifying, but they are fair, and they create the best late game tension I’ve ever felt. Patches don’t delete your knowledge they make it evolve.  If you’re new and looking over the wall, you don’t need to know everything. Learn what vision does to a fight. Learn when a smoke is worth more than a stack. Mute fast when you need to. Pick a couple of heroes that make you curious and repeat them until your hands know what your eyes want. One day you’ll pull the wave to reset equilibrium without thinking, and that tiny habit will feel better than any big number on a scoreboard.  To everyone at Valve, from artists to analysts to the people keeping servers breathing on patch night, thank you for treating a free game like a craft project. Dota still feels handcrafted even when it’s loud and messy. Replays, silhouettes you recognize at a glance, the quiet relief of a clean load-in, it all adds up. If there’s one wish, it’s this: keep investing in the first ten hours so more players hit that “I get it now” moment sooner, because once it lands, they aren’t leaving.  I recommend Dota 2 without hesitation. Not because it’s easy, but because it respects the time you give it. It will frustrate you, it will humble you, and then it will hand you a win that sends you to bed smiling at the ceiling. See you at nightfall, smoke ready, buybacks aligned, one good call away from a story worth telling.","baik"
"76561198075454868","Dota 2, not a bad thing I can say about the game itself. I have spent thousands of hours, played approximately 7000 games, grinded to Immortal (highest possible medal) in ranked and finally got there after 10 years of playing but it has been a rollercoaster. The game itself is well optimised, no 2 games are exactly the same, it's a fantastic game to play with friends if you can fill a party and you can be as creative as you like with how you play a lot of heroes that the game has to offer.  I feel like if you are reading this, you have probably seen so many reviews telling you not to play because of the community, and that can't be ignored. I totally agree with the other reviews saying how bad the player base is. Ultimately, although a competitive game is usually a lot more fun when you are winning, you can't play a game that you are only going to have fun when you are winning otherwise if you end up playing the game for 10000 hours like me, you will only enjoy 5000 hours of gameplay with a 50% winrate. If you are eager to play this game, the most overpowered ability everyone can use in game is the mute button, pre-mute the entire lobby upon loading in. If your team start losing, 9/10 either you will be flamed (even if you are playing well) or the whole team cohesion breaks down.   If the reason you want to play this game is to enjoy the teamplay and social aspect of playing a 5 vs 5 competitive game, I suggest you play something else. If you want to challenge yourself as a solo player, focus on your game entirely and develop your skill... then this game is extremely rewarding as you get better. I love this game and always will, but I am in love with the game itself and certainly not the people who play it. These people have nothing else going on in their lives and are essentially gambling with their serotonin, if they winning they are happy and if they losing they are children.  To put it into perspective, I come home from a long day of work and maybe play 1 or 2 games, I play something fun and creative, like a hero that is usually an offlane hero as a carry, if we win I'm a legend, if we lose people start crying and start pointing the finger. I have fun regardless because of the mute button, but if you don't have thick skin, this game will negatively affect your happiness.  Good luck and have fun, praying that the community treats you well (although I doubt it).","baik"
"76561198335229408","Best game, This game make me like at zoo with the entry ticket is my soul, if you never going to zoo this game will give you an experience like at the zoo with so many Animal inside of it.","baik"
"76561198055297280","Skipped classes thanks to Dota. Learned to gamble thanks to Dota. Learned to swear in 12 different languages thanks to Dota. Became racist thanks to Dota.  All in all, Ruin your life simulator. 10/10 would recommend if you are trying to kill yourself.  Cancer can be cured, Dota community can't be.  35 years old and I always end up playing this game. I have everything good in life. A loving wife. An amazing daughter. A great Job. But somehow I am always looped back into this madness time and again the second I get any free time.","baik"
"76561198090111143","This is the game you want to play if you want the heroin fix of league but also the superiority complex of not playing league","baik"
"76561198196459017","If life seems to be running smoothly, Dota may offer the challenge you seek. It tests the strength of friendships, pushes the limits of one’s patience and decision-making, and introduces a variety of languages—all within the span of a single match.","baik"
"76561199062197712","I’ve put 1200 hours into this game, which is basically a part-time job with no pay and no health benefits but at least I can say I’ve mastered the art of fountain diving. Would I recommend it? Absolutely. If I can sink 1200 hours into it and still log in like a raccoon returning to the same dumpster every night, you probably will too.","baik"
"76561199497926702","[H3]It's a good and skill-dependent game if you understand it. BUT this game has the most toxic community of any online game. It's just a bunch of ***. I hope that Dota will live forever, because it keeps all these *** in check, and if Dota gets shut down, they'll move on to other games. It's a good thing that Dota players don't know about other games. If you decide to play, only play with a full party.","baik"
"76561198051539046","I've been playing Dota since its early days as a custom map in Warcraft III long before Dota 2 became the global phenomenon it is today. For me, this isn't just a game it's a huge part of my childhood and personal growth.  From Dota 1 to Dota 2, I've witnessed how the game evolved so called new mechanics, updated heroes, refined graphics, and better matchmaking systems. While some changes felt overwhelming at first, I’ve come to appreciate that evolution is part of what makes Dota such a masterpiece. It constantly challenges you to adapt, learn, and grow.  But Dota is more than just a game of mechanics and skill. It’s taught me so much about critical thinking, teamwork, communication, and even how to manage my emotions during high-pressure, often chaotic moments. Every match is unpredictable and that’s what makes it endlessly rewarding.  My Advice: Don’t play this game if you have low patience, poor communication, or if you prefer solo gameplay.  Dota is not for trolls or for those who take team coordination lightly.  If you're ready to be humbled, challenged, and (eventually) sharpened—welcome aboard.  This game holds many cherished memories, including countless moments with online friends I've made along the way. Some of them are no longer with us, and I want to say: RIP to my fallen teammates—you’ll always be part of my journey.  Cheers to Dota—for being more than just a game. It’s a lifelong lesson in resilience, strategy, and camaraderie. GGWP. GGEZ ","baik"
"76561198347249424","It's a wonderful, friendly, and positive game... in bot matches. The moment you play with real people, you get a detailed genealogy lesson","baik"
"76561198307637623","With over 3,800 hours poured into Dota 2, I can confidently say this game is more than just a pastime, it's a way of life. Every match is a new challenge, where strategy, teamwork, and skill are constantly put to the test. No two games are ever the same, and that’s what makes it so addicting. The depth of mechanics, hero variety, and the ever-evolving meta keep things fresh even after thousands of hours.  The feeling of executing the perfect team fight, landing that game-changing Black Hole, or carrying your team to victory after a grueling 60-minute battle is unmatched. But on the flip side, the game will test your patience like nothing else. The highs are incredible, but the lows can be brutal. It's a game that rewards dedication and punishes mistakes, making every win feel truly earned.  The community can be intense, and the learning curve is steep, but once you get past the initial struggle, Dota 2 becomes one of the most rewarding experiences in gaming. Whether you're playing casually or grinding ranked, every match teaches you something new. Even after thousands of hours, I still find myself improving and discovering new ways to outplay opponents.  Dota 2 is not just a game, it's a never-ending battle of wits and reflexes that keeps you coming back for more. If you’re willing to invest the time and effort, it’s one of the most satisfying and competitive experiences out there...","baik"
"76561198306460118","Dota 2 is both curse and blessing.  A battlefield that pulls you in with joy, then spits you out with hate.  You promise yourself never again—yet the taste lingers, and you return.    I play when I’m happy, when I’m broken, when my mind drowns in endless storms.  This is not a game for soft hearts.  It is for those who crave to feel, to bleed, to struggle, to conquer.  For those who want to clash with others, raw and unfiltered, no masks, no censorship.    Dota 2 is not just a game.  It is a mirror, a war, a ritual—  a cycle of pain and passion that never lets go.","baik"
"76561199840578174","A bit over 4 hours in, and suddenly it's 2am. I was gonna play one game, maybe two. Now my coffee's cold, my cat's judging me, and I'm screaming at strangers on the internet about ward placement. 10/10, would totally sacrifice sleep and sanity again. This game is like an abusive relationship with graphics and the occasional win that keeps you coming back for more. I've lost my social life, my team blames everything on me, and I love it here.  If my MMR is going down, I’m dragging my mental state with it","baik"
"76561198037774204","Dota 2 needs no introduction—and no commentary.  After 11,000 hours over 10 years, it’s become a way of life.  Now, I’m starting to train my son 😄  There’s no other game I’ve uninstalled so many times…  …but nothing else scratches that rush like Dota.  GG.","baik"
"76561197997642896","Started playing this game because I was gambling on it without having any idea what was going on. Fast forward I have 1600 hours and I am hardstuck 800 mmr because the only people that play are smurfs. I would not trade my experience on this game for anything in the world. Except for my grandma back.","baik"
"76561198973752699","I learned to love Dota 2 by playing support at 2 AM, buying wards I swore I couldn’t afford, and watching a hopeless lane become winnable because the map finally made sense. This game is a long conversation with your past self. Yesterday you overextended for one more range creep. Today you drag the wave, plant a sentry on instinct, and live to tell the story.  The magic is how cause and effect stay visible. Win a fight near an objective and the whole river tilts in your favor. Lose a fight with buybacks down and you can feel the punishment in your bones. Patches change the surface, but the logic underneath remains readable. If you pay attention, Dota forgives slower than most games, and teaches faster than you expect.  People joke that nothing feels better than a rampage, but my favorite moments are quieter. A smoke that threads the needle between two wards. A carry who trusts a risky call because you pinged it with confidence. A glimpse of a courier path that gives away an ancient stack. These are tiny, human victories that never show up on the scoreboard and somehow matter most.  If you are new, you do not need encyclopedic knowledge. Learn why vision wins fights. Learn that it is okay to trade farm for tempo. Mute early when needed and keep the chat wheel for jokes, not judgment. Pick two or three heroes that make you curious and keep them until your hands know the buttons before your brain does. There is a day when you stop panicking at the minimap and start reading it. That day changes everything.  To the folks at Valve, thank you for making a competitive game that still feels handcrafted. The silhouettes remain readable, the replays are a gift, and the client gets out of the way when it matters. If I could ask for anything, it would be richer first hour guidance and more guardrails around early social friction. The moment someone feels their first real swing of agency, they stay.  I recommend Dota 2 because it stays interesting in the small details long after the big ones are familiar. It is stubborn, brilliant, occasionally infuriating, and somehow the perfect place to spend a late night with four names you may never meet and a plan that might actually work. See you on the high ground.","baik"
"76561198765839270","Dota 2: Love, Pain, and Poor Life Decisions  Free to play. Paid in emotions. One match gives you hope, the next makes you question every decision that led you here. It hurts, it redeems itself with one good game, and somehow convinces you to queue again.  A terrible choice. A beautiful one.","baik"
"76561198375112842","Consistent updates, fixes and upgrades. If you split russians to their own servers to be able to play only between them, it would be ideal.","baik"
"76561199364044333","Please dont get into this drug of a game.  It'll hook you for hours at a time while also destroying your mental strength and temper  Best moba game of all time tho . complexity is what makes this game so much better than slop league  Also . people like to report your profile in game for no reason other than to get to you  I had ~6000 reputation points (which is borderline really bad) for months even tho i never swear on comms or on chat  Very childish playerbase sometimes","baik"
"76561198065528106","this game's if one of the few thing stopping me from having a perfect relationship save you're self some time and happiest and don't install   10/10 keeps me awake at night","baik"
"76561198371877721","Dota 2 is a giant, living puzzle. Every match asks you to read the draft, map, timings, and items, and then make five people row in the same direction. The high points are unmatched: a perfectly timed smoke, a clutch buyback into Roshan, or a base defense that flips the game in thirty seconds. Frequent patches keep the meta fresh without deleting everything you learned.  The price of entry is real. The tutorial barely scratches the surface, solo queue can be unforgiving, and the information firehose hits you before you’ve built the mental models to parse it. Long matches also mean every mistake has time to snowball.  Form a small group, pick a few comfort heroes, and commit to communication, and Dota becomes endlessly rewarding. If you need quick wins and short sessions, this may test your patience more than your mechanics.","baik"
"76561198097918683","It was fun while it lasted, now we're all just a bunch of old farts. Feels like it was yesterday, kind of a weird and unpleasant feeling tbf. Time to move on with our lives boys. Thanks for all the good times volvo, cheers !","baik"
