"SteamID","Ulasan","Status"
"76561198043610692","Wonderful game! Great gameplay, great graphics, fun for hours and hours, it never gets old.   Message to devs:  You guys are doing a great job at retention, but the game would also greatly benefit from having more people play. For this, it needs to be more accessible to beginners, and casual players.  1- fix smurfing. Currently the main issue holding back the potential of the game in non ranked games (where casual players hang). Reporting is not enough, smurf accounts need to be banned, and IPs creating several smurf accounts need to be prevented to do so.  2- Improve beginners experience. The tutorial is good, but limiting playable heroes at start just creates frustration when new players can't play their favorite hero. Instead, have suggested heroes. Match making amongst players with 0 games or 0 victory is a must have (and of course coupled with the smurf fix above). Bots training is great but it's boring. It's very important to let beginners play with other beginners.  3- Skin quality. This is a much lower priority item, but it could really improve monetization. Many base models and old skins have really poor model/texture/etc. quality. The reward of receiving a random skin after a game is negated if said skin is so poor quality that it's not even worth equiping. Also, one of the stregth of Dota2 against competitors is the visual quality, so making sure all models have a consistent baseline quality, and staying coherent with the universe, is key to preserve and emphasize this strength.  Cheers!","baik"
"76561198157096730","Garbage MOBA, dead game, brainless teammates, wannabe pos1-3, SEA best server> !  -> I only played this game to enjoy it with my friends. :)","baik"
"76561198139585701","Stupid game for stupid people. I don't know why this fucking still fucking exist. Why is it not dead yet? Please stop playing so I can stop too.  Anyways, highly recommended. Will play again 'till either this game or me dies. Fck you for reading this.","baik"
"76561199184234735","The most-played game on Steam. Every day, millions of players worldwide enter battle as one of over a hundred Dota heroes. And no matter if it's their 10th hour of play or 1,000th, there's always something new to discover. With regular updates that ensure a constant evolution of gameplay, features, and heroes, Dota 2 has truly taken on a life of its own.  One Battlefield. Infinite Possibilities. When it comes to diversity of heroes, abilities, and powerful items, Dota boasts an endless array—no two games are the same. Any hero can fill multiple roles, and there's an abundance of items to help meet the needs of each game. Dota doesn't provide limitations on how to play, it empowers you to express your own style.","baik"
"76561198019727792","game where strategy and teamwork, yes some of the heroes are OP and smurfs run around like its a kid's play ground, but to battle and to try to win, to lose and refuse to give up!!!, plus the cosmetics are awesome. you can get almost everything for free by just playing.","baik"
"76561197999351238","Very competitive, it degenerated your brain and your well being. It may cause depression and anxiety, as well as suicidal thoughts. By overall, very nice and fun game.","baik"
"76561198824102272","Overall this game is very hard and competitive, i love that this game has many skins, but the behavior score is broken i think because its very hard to increase.","baik"
"76561197986604057","It's all about positioning. This is the original MOBA, with a steep learning curve as victory is never assured, and comebacks are a real thing. The game is hard to pick up, as the complexity of skills, counter skills, positioning, timing, spacial and battlefield awareness will put all your reactive, tactical and intuition to the test more than running from the cops ever will. You will die at first. A LOT. And you will get flamed. But if any game truly rewards persistence, resilience and quiet victories, this is it.","baik"
"76561198119459216","a great game that needs better public matchmaking new players should be locked in new player mode for 600hours and have to play 500 games to not greif the community at large and All smurfs banned.","baik"
"76561198402336121","Dota 2 - это удивительная игра, которая объединяет людей со всего мира и дарит невероятные эмоции. Она поражает своей глубиной и стратегическими возможностями: каждая партия уникальна, и никогда не бывает двух одинаковых игр. Огромное количество героев, предметов и комбинаций делает геймплей по настоящему безграничным, а командная работа и грамотная тактика позволяют почувствовать себя частью чего-то большого.    Особенно радует, что игра постоянно развивается: разработчики регулярно добавляют новый контент, обновляют баланс и проводят крутые события. Атмосфера соревновательности и драйва заряжает энергией, а красивые визуальные эффекты и музыкальное сопровождение создают особое настроение.    Dota 2 - это не просто игра, это целый мир, где можно найти друзей, испытать радость побед и даже научиться важным вещам, например: терпению, стратегии, умению работать в команде. Это проект, который по праву занимает место в сердце миллионов игроков и продолжает вдохновлять снова и снова.","baik"
"76561198367471798","Few games have shaped the esports landscape as profoundly as Dota 2. Developed by Valve, this free-to-play multiplayer online battle arena (MOBA) stands as a towering giant in competitive gaming—complex, rewarding, and fiercely strategic.  At its core, Dota 2 pits two teams of five players against each other in a battle to destroy the opposing team’s Ancient, a heavily guarded structure deep within their base. With over a hundred unique heroes, each boasting distinct abilities, playstyles, and roles, no two matches feel the same.  The game balances macromanagement of the battlefield with micromanagement of your hero’s growth—you’ll be farming gold, buying items, coordinating with teammates, ganking enemies, and executing game-changing team fights. It’s a demanding dance of skill, strategy, and split-second decision-making.  Dota 2 is notoriously complex. Its steep learning curve can be daunting for newcomers, but the depth is precisely what has kept the community thriving for years. Every patch introduces balance changes, new items, and sometimes new heroes, ensuring the meta continually evolves.  Mastering one hero, let alone the entire roster, requires time and dedication—but the satisfaction of outplaying an opponent or turning the tide in a crucial moment is unparalleled.  Visually, Dota 2 is colorful and detailed, with each hero uniquely animated and designed to stand out. The maps are richly textured, providing clear tactical information while remaining aesthetically pleasing. Sound design is top-notch, with distinct voice lines, spell effects, and ambient noises contributing to the immersive experience.  With one of the largest esports scenes globally, Dota 2’s The International tournament offers multi-million-dollar prize pools and draws millions of viewers worldwide. The community is passionate, vocal, and dedicated, though the competitive nature can sometimes lead to a steep social environment.  Dota 2 is a monument to strategic depth and player skill—a game that rewards patience, teamwork, and creativity. If you’re willing to invest the time, it offers a rich, endlessly evolving battlefield where every match is a new story.  Complex, competitive, and compelling—Dota 2 remains the pinnacle of MOBA excellence.  Rating: 9/10","baik"
"76561199130650939","Очень интересная стретегическая игра. Развивает критическое мышление и стрессоустойчивость, после тяжелого рабочего дня максимально приятно потратить пару часов в компании приятных образованных людей которые правильно умею доносить информацию. Больше всего я удивился с того что мои союзники знают о моих родителях больше чем я сам. Всем рекомендую, учите детей родителей друзей, вообще кого угодно!","baik"
"76561198129440550","I really enjoy how supportive and positive the Dota community is. Nothing motivates me more than being told to uninstall by a teammate at minute 3.","baik"
"76561198862704591","Having 300+ hours on this game, I guess its safe for me to say that it has caused me mental breakdowns one after another","baik"
"76561197985368010","This is not a casual game! Highly competitive.   If you have ever said ""It's just a game "" don't install it. Seriously.    This is not a simple game! If overly complex tactics and strategies are overwhelming. This game isn't for you.  There are a lot of variables, synergies, counters maneuvers, tactics etc to consider. There is a very large learning curve, many players do not reach the plateau of this curve , never mind the peak. The game is un-fun for people below this plateau. Imagine trying to play football without knowing what an offside, a field goal  or a punt is.   There are layers to understanding where a concept clicks and you think you understand, yet you are not seeing the bigger picture.  Football is considerably simpler but an analogy would be:  ""I am run ball, I am reach back, points is good, Don't get tackle. Sometimes I can throw, I'm master tactician""  -Most people     If you have a competitive heart and are prepared practice and fail to get better to achieve better skill expression this is one of the best games for that.    This is the original and best MOBA. I've played most of the big name competitors.  LOL can't match the depth and the strategy. HON being a clone did a good impression.  The game is a well executed strategic staple that will go down as one of the greats.    DOTA does have issues with the developers keeping their favorite heroes at the top of meta and keeping broken stuff in game because of fan noise also there are issues with rank assignment and smurfing in public games now that the game is older and less attention is paid to those kind of problems. These can be complex issues to solve and most games have similar issues.    TLDR  One of the best games ever, not for filthy casuals. Get good or move on.","baik"
"76561198209718779","[h1]Dota 2: A Beautiful Disaster[/h1]    Dota 2 is the ultimate teamwork game for ten psychiatric patients fighting not just the enemy but each other. In theory, it’s a 5v5 strategy game. In practice, it’s a chaotic battleground where allies [b]flame harder than enemies[/b], supports forget they’re supports, and everyone slowly loses their grip on reality.    Every match is a new [i]psychological experiment[/i]. Who will tilt first? Who will throw the game hardest? And in the end, only one mentally intact player may remain, if any.    Play Dota 2 where losing isn’t just likely, [u]it’s emotionally devastating[/u]. And your teammates will make sure you never forget whose fault it was.    [spoiler]Welcome to the madness.[/spoiler]  ","baik"
"76561198077266013","Constantly evolving and changing, being challenging and at the same time stresfull, but with a lot of options to take and experiment, is an amazing game. EXCEPT FOR THE PLAYER BASE. More toxic than any Hazard area, this game is completely hard to enjoy sometimes playing solo. Usually with 3 friends the games feel pretty better. Anyway, I like the game.","baik"
"76561198263873282","if you want a happy life never install this game, it will take your soul and sanity     btw its a fun game thou","baik"
"76561198335044288","I’ve wasted over a thousand hours playing this terrible game with awful teammates, and I’m still playing. It’s the worst game ever. 10/10 would recommend.","baik"
"76561198763852686","If I were to lose everything but still was able to play Dota I would be Happy, thats all ypu really need to know about this game, im a rather new player and this is the hardest game I have ever played the community can be nice but most of the time they are not which is okay i understand the will to win. Dont be scared if the first 20 hours dont go well this game is a learning exp and you will learn in every match. If you want the closest thing to feeling what its like to be rewarded in real life play Dota watch the years of history (true sight) and get excited for the next Ti, its honestly given me so much more happiness in life compaired to any other competive game I look forward to seeing how far I can go.","baik"
"76561199440447273","Somewhere between the silence of midnight and the cold glow of my screen,  I found a place that doesn’t ask questions.  No explanations. No expectations. Just... quiet.  Out there, victory means nothing. Loss means nothing.  What matters is that the voices fade. The faces blur.  No one waits for me there. No one wonders why I’ve changed.  And maybe that’s the point.  I don’t play to win.  I play to disappear.    ","baik"
"76561198112832016","This game keeps me connected with my friends who are now spread all over the world. Some great memories for me come from Dota times.","baik"
"76561198055553404","I’ve played Dota → HOTS → LoL → Dota again. From experience, Dota’s strategic depth is far ahead of its competitors. Itemization, hero design, and core mechanics all have a much greater impact on how each game plays out.  If you prefer micro over macro play, Dota still holds up. It focuses less on pure skill shots and more on positioning, timing, and decision-making. With its many active items and abilities, you often manage anywhere from 2 to 13 buttons, sometimes even controlling multiple units with their own skills.  LoL feels faster and more reaction-based. You die quicker, and crowd control is usually shorter and easier to dodge. In Dota, disables tend to last longer, which shifts the focus toward planning and positioning rather than constant reflexes.  After returning to Dota, I can’t go back to LoL. Dota’s hero and item design are more engaging, and fights feel more deliberate—you don’t just evaporate instantly.  Bonus points to Dota for its launcher and cosmetics—you can customize music, merge skins, and the client works flawlessly. I once saw a streamer in a match pause, open demo mode to test an interaction, and resume the game within seconds. It’s simply more polished.","baik"
"76561198376322977","Seems fun :3  It's not a clicker like league of losers but an actual strategy game with a deeper meaning: what if there where no generals in war and only mental babies arguing and trying to fill the geneva convention checklist.","baik"
"76561198227362292","After playing over 700 hours of Dota 2, I feel pretty confident sharing my thoughts on the game. It has an incredible amount to offer, both in terms of gameplay and engagement. Before you know it, you're playing for hours every day.  The mechanics are amazing. Not only do you have a huge variety of heroes and items to choose from, but you also need strong teamwork to secure a win. There are so many variables in each match that every game feels fresh, and there's always something new to consider. Of course, mastering it takes a lot of time.  That said, while I’ve really enjoyed the game so far, it does have some drawbacks, like cheaters and smurf players, which can hurt the experience.","baik"
"76561198306901534","some of these heroes are absoloute cancer  id rather be spitroasted by 4 men while getting sodomised at the same time than go against this cancer  amazing game","baik"
"76561198167468764","Its wonderful game to play with friends. If you want to friend who is the true friend of you, please guide them play this game and you will know the opposite attitude of your friends are. Kaka still be the best game in the century. Edit on 2025","baik"
"76561198101125948","Coming from other MOBAS I can not help but compare. League And Dota the two most popular, but completely on separate levels. Dota is by far the Best MOBA in existence, then depth then nature where Death means everything even with the buyback feature.   The pros of Dota are yours to figure out. The cons are yours to reap.  League makes me Depressed, Dota makes me take accountability.  I wish Dota's player count would surpass league as it is far more complex with much better mechanics.   In short   Dota is for those who love complex strategy. Dota is not for quitters.","baik"
"76561198297852934","Dota 2 – A Ruthless, Ever-Evolving Test of Skill and Strategy  Developer: Valve Release Date: July 9, 2013 Platforms: PC (Windows, Linux)  Overview Dota 2 is not just a multiplayer game—it’s a commitment. From the very first match, it makes one thing clear: this is a game that does not hold your hand, does not forgive mistakes easily, and demands your full attention. As a five-versus-five competitive MOBA, Dota 2 pits two teams against each other in a battle of strategy, mechanical skill, teamwork, and mental endurance. Playing Dota 2 today feels like stepping into a living ecosystem that has been refined, expanded, and reshaped countless times. Every match tells its own story, filled with comebacks, clutch plays, devastating missteps, and moments of pure brilliance. It’s brutal, complex, and often frustrating—but for those willing to learn it, Dota 2 offers one of the deepest and most rewarding competitive experiences in gaming.  What Makes It Great? ✅ Unmatched Strategic Depth Dota 2’s greatest strength is its depth. With over a hundred heroes, countless item combinations, and near-infinite strategic possibilities, no two matches ever feel the same. Drafting alone is a game within the game—counter-picks, synergies, and bans can decide the outcome before the match even begins. Every decision matters: when to push, when to farm, when to fight, when to sacrifice yourself for the team. The level of strategic freedom is staggering, and mastering it feels incredibly rewarding.  ✅ Heroes With True Identity Unlike many MOBAs where characters feel interchangeable, Dota 2’s heroes are wildly distinct. Each hero has a unique playstyle, strengths, weaknesses, and personality. From complex spellcasters like Invoker to mechanically demanding carries like Meepo or micro-heavy heroes like Chen, the roster supports every type of player. Learning a hero feels meaningful, and mastering one can take hundreds of games.  ✅ A Constantly Evolving Game Dota 2 is always changing. New heroes, major map reworks, balance patches, item overhauls, and gameplay systems continuously reshape how the game is played. These updates don’t just tweak numbers—they fundamentally alter strategies, metas, and priorities. This constant evolution keeps the game fresh but also ensures that even veteran players must adapt and relearn.  ✅ Incredible Competitive Integrity There is no pay-to-win here. Every hero is available to every player from the start. Victory is earned purely through skill, knowledge, teamwork, and execution. When you win, it feels deserved. When you lose, you know exactly where you failed. Few games deliver this level of competitive purity.  ✅ Sound Design and Clarity Dota 2’s sound design plays a huge role in gameplay. Spell audio cues, announcer lines, hero voice acting, and ability effects provide critical information during chaotic fights. The iconic announcer, hero taunts, and environmental sounds give the game personality without sacrificing clarity. The soundtrack and audio effects elevate tension during big moments, especially in late-game team fights.  ✅ The Esports Legacy Dota 2’s competitive scene is legendary. The International remains one of the most prestigious esports tournaments ever created, with unforgettable moments that have shaped gaming history. Even for casual players, watching high-level Dota can be inspiring and educational, showcasing the game at its absolute peak.  What Could Be Better? ❌ Extremely Harsh Learning Curve Dota 2 is one of the hardest multiplayer games to learn. There are countless mechanics—denying, creep equilibrium, vision control, item timing, power spikes—that the game does not properly teach. New players can feel completely lost for dozens of hours. This barrier to entry is one of the biggest reasons many players quit early.  ❌ Toxicity and Mental Pressure Because Dota 2 is so team-dependent, frustration can boil over quickly. Toxic behavior, blaming, and negativity are still common issues, especially in ranked play. A single mistake can snowball into a lost game, and not every teammate handles that pressure well. Playing Dota 2 requires not just skill, but mental resilience.  ❌ Long Match Commitment Matches can easily last 40–60 minutes, sometimes longer. Leaving is heavily punished, which means every game is a serious time investment. This makes Dota 2 less accessible for players who want quick or casual sessions.  ❌ Visual Clutter in Late Game While the visuals are strong, late-game team fights can become visually overwhelming. With dozens of spells, particles, and effects happening simultaneously, it can be difficult to track everything, especially for newer players.  Final Verdict ⭐ 9/10 – A Brutal, Brilliant Competitive Masterpiece ⭐ Dota 2 is one of the deepest, most demanding multiplayer games ever made. It rewards intelligence, teamwork, patience, and mastery like few others. Every victory feels earned, every loss teaches a lesson, and every match has the potential to become unforgettable. Its steep learning curve, toxicity, and time commitment make it inaccessible to some—but for players willing to invest, Dota 2 delivers an experience that no other MOBA can truly match. It’s stressful, exhilarating, frustrating, and addictive in equal measure. If you’re looking for a game that will challenge you mechanically, mentally, and emotionally—and keep evolving alongside you—Dota 2 remains one of the finest competitive games ever created.","baik"
"76561198084945306","Um dos melhores MOBAs já feito. Tem um ótimo balanceamento de itens e personagens. Bons eventos que mantém a comunidade engajada. Se você quer jogar um jogo justo e com profundidade, essa é a opção ideal","baik"
"76561199852910316","The players in Dota 2 are bipolar diseased little princesses. They think the world revolved around them and the off-laners, mid-laners, safe-laners think the HS and supports are their fucking slaves. The idiots who play this game, come here to play and vent out their frustrations in life like they think others are beneath them. GROW THE FUCK UP LITTLE SHIT PRINCESSES. YOU'RE NOT IT. Good thing valve added a mute feature and avoid to prevent yourself from playing with idiots that are cognitively impaired.   Just a piece of advice, I do recommend playing this game because it's competitive and a good stimulant to your brain. If a player is nice, don't mute them. Keep an open mind and avoid the idiots who think they're IT, MUTE THEM! DO NOT ALLOW YOURSELF TO GET IN THEIR LOW LEVEL OF BRAINLESS THINKING AND DECISION-MAKING.","baik"
"76561198023662496","Had to stop play it, I have no idea how dota does that but it completely ruins my wifi connection, my wifi for whatever reason turns off and Im unable to connect to internet until I dont restart whole system. Im 100% sure it is caused by dota, my wifi is perfectly normal throughout entire time until I start playing dota, also its the only game in which i was experiencing lags, I have no idea how bad it can get with one game in such regards, game is good, gave some money into it but its functionality is one of the worst if not the worst I have ever experienced in a game.","baik"
"76561199308577756","It's a good game, but I hope some of the heroes' abilities are the same as before, especially Dazzle. Because there was a time when fights were actually more interesting when the only limitation was the players' skill.","baik"
"76561199066647643","People say this game ruined their life and stuff but I say it depends on how you use it! So as long as you are in control this game is even good for your life skills! that being said yes people can be toxic in this game but I also found some of my best gamer/online friends in this game! It's a game hard to master and almost always has something new to show you! overall good game, try it!","baik"
"76561199093475112","este jugo es una mrd la calibracion esta  mal  el emparejamiento esta mal aun asi seguiria jugando no por que quiera ser mejor si no ppor que quiero joder como me jodieron paz y amor anthonee  ","baik"
