"SteamID","Ulasan","Status"
"76561198034263872","The forced 50% win/loss valve matchmaking ruins the entire game. Your effort and time is completely wasted when you are forcefully grouped with players who clearly do not belong in the higher ranks. They are carried by valve matchmaking to keep them addicted, while also ruining the experience for better players. Could have been a much more popular game. Sad management.","buruk"
"76561198074410972","game was good 2016 but now is trash items and new heroes are broken....bkb does not have point vs pudge and some abilitys....","buruk"
"76561198085368913","Numerous comments from hundreds different players complain about the troubleshoots, errors and bugs in Dota2 Matchmaking system. dozens games in a row always on Dire/Radiant team. never random. system clearly rigged. Not to mention 7 out of 10 games have connection issues. Dota 2 is clearly an amateur game.","buruk"
"76561198299136329","I have been enjoying the game for almost 10 years now. Lately you will be getting a bunch of Smurfs and they do nothing if you report these Smurf accounts, despite stating that they will be going harder on people with 2 or more accounts. This really makes a great game not so much worth playing anymore. People who spend money to make their heroes look good and just try to have a good time in a competitive game and then you end up playing against a bunch of smurf accounts and the new players in your team are actually new players. So if you are in the lower MMR brackets. If you report players for Griefing, they take immediate action, but for Smurfing, absolutely no action. Beware that you WILL get a bunch of smurfs in the enemy team and most likely will want to uninstall after that. I Valve will crack down on the Smurf accounts, it will be a lot better to play this game.","buruk"
"76561198112882887","The community is filled with people that will not communicate effectively, the communication ban system is based on groups that can mass report for no good reason, and being an ""average"" player is punishing because you get matched with smurfs and toxic team mates. I have almost 9000 hours and I can safely say this game has fallen off in the past 3 years.","buruk"
"76561198016249928","Not if you're 35 years old like me. Because you're playing against kids whose lives depend on the game and then they insult you because, well, you're not playing the way they imagined it.","buruk"
"76561198081369759","Great game witrh the worst community in SA/NA that ruin gaming experience, a lot of grief, toxic communication, racism. I don't recommend playing this game until some players get permanently restricted to play the game","buruk"
"76561198094619485","Play this game since 7th grade and now with 2 childs, I DO NOT RECOMMEND people playing this game.     Some said, you can master anything after 10000 hours of practicing, clearly they never try DOTA2 because clearly, after my fucking 13300 hours of playing this game, I clearly sucks based on the comment of fucking retarded teammate and my behaviour scores. Thanks to this game, I am no longer have my sainity or believe in human again!","buruk"
"76561198071378463","Only mongoIic people like this game, it's like all their social skills, common sense and normal human behavior were sacrificed in order for their distorted and defective mind manages to like this crap. Eat a nutsack if you like this game.","buruk"
"76561199696551453","Go away from this game people. Only way is to have 5 player team, otherwise game is forcing you 50%. 1k or 4k, its literally same skills. You just depend on matchmaking luck, so take ""PLAY DOTA"" button as throw dice in casino.","buruk"
"76561198198720601","not recommended for free 2 play player..the game will force u to buy dota plus subcription. they will keep matchmaking u with impossible to win team-mate until u buy dota plus. then suddenly its magically u start winning game when u have dota plus subscription.","buruk"
"76561199588735977","do not play, community is horrible, will flame you even if you have just bought the game. Uninstalled within 5 hours of playing. Tutorial is terrible and buggy, and then I get people trying to report me because i'm making mistakes while trying to learn. I never should have even downloaded it.","buruk"
"76561198127567438","You can't ff/end even when your whole team wants to quit, feels like a cage for 60 mins in some games. Matchmaking is garbage if you're not 5k+ mmr player or you're not a new player. Great game to watch, not a great game to play.","buruk"
"76561198272030551","Refer to my smite review.      This game is somehow worse, every character is super hitler^2 it's so annoying should give you fifteen bans I swear to god I also cannot stress enough on how terrible the ""new player help system"" is god forbid you want to try anyone that's even remotely interesting sure man prevent me from playing someone that has to think 3% harder than the characters they """"""""think"""""""" are appropriate but queue me with a like lvl 100 account make it make sense  Why is the ban system the way it is? It's so dogshit if I only have one character selected there is a good chance they just wont get banned and I wasted it but if I have multiple the main one I want banned can go free then be picked Oh another thing like every competitive multiplayer valve game snowballing is completely batshit insane every game im either 5 levels higher than their highest or 4 levels under their lowest  The one good thing I'll give this game is that Tiny is one of the funniest characters in a moba ever  ","buruk"
"76561198086061023","When buying items, it is not mentioned if effects stack or not? Why!?  When dead for like 2 or more minutes, High lvl  after buyback- dumb dota count you as AFK if you do not look around the map , and punish you with abandon and other consequences. Why Dota? Wtf is wrong with you?  I have just been punished, while 90secs dead, die in 20 secs, then buyback and dead for 100+ secs, and i got abandon !? Wtf is wrong with you. Why i must act while dead ??? Or what ?","buruk"
"76561198049792048","It's probably better than League of Legends, but I don't intend to play either game again. HOTS is a better time than either.","buruk"
"76561199028607953","Really bad game, no one f**king plays their role, and you will get most of the matches like that, so deleting this game and never going to play it again.","buruk"
"76561198081272169","Noone should ever play this sh*t.  Valve killed dota with that matchmaking. It is only for sendbox abusers and low skill players. Every game i got 1x9 game.","buruk"
"76561198141845463","the communication and behavioral score thing is a mess and does nothing but make communicating with your teammate impossible if you fall below a certain number and it does not increase. I haven't played in years and my score hasn't reset at all. Kinda Sad that they took freedom of speech away from my favorite game like that, now Im gonna have to abandon it :(","buruk"
"76561197989537077","I don't recommend Dota 2 for new players because it's simply unwelcoming, frustrating and doesn't give much back to f2p players like cosmetics and stuff.","buruk"
"76561198331076107","I really love this game, been playing it religiously since 2013. However, I am very disappointed with how no one is reviewing reports and banning cases in this game. I recently convinced one of my friends to try and play DOTA 2. Since he had a new account, we could only play normal matches together. I main Invoker so as broken as he is, I would normally get lots of kills and have a real presence in the map. However, due to playing Invoker how he is supposed to be played, I was reported as a smurf and ultimately got banned. I appreciate the effort that DOTA is giving to prevent smurfs and hackers from destroying the game, but I am just disappointed with how I was wrongfully banned. I tried sending an appeal, offered to give evidence that this is my only and main account, but I was only given a generic reply. I am writing this to warn people. There is a big power currently given to reports. Play well enough or piss enough number of people and you will be saying goodbye to your account. Nevertheless, the game is fun and addicting. I kind of thankful that I am unable to play so I can stop wasting time on this game LOL.   Note: the lobbies that I get matched into usually have 1-3 players in the enemy team that is either as good as me or better.  Additionally, I do not send harmful stuffs through chat at all, worse that I can say is ask ""where is your bkb?"" to my carry. Lastly, I spammed invoker around 5 years ago, my skills on him is definitely on a higher level compared to how I play other heroes.","buruk"
"76561199555565441","I used to play this game a little bit and I remember it being pretty fun! Dude I was so wrong to download this again. If you have played a MOBA before, you will literally not be able to decipher this games cesspool of a UI system on the first try. Even if you've played Warcraft 3 through or DOTA 1. Are you ready for an RTS amount of hotkeys but you are controlling a single unit? Sure depth, pro play, get good good, blah blah blah. I'm not trying to relearn a game I've already spent like at least 500-600 hours on and already knew how to play. I could pick up League or Smite tomorrow and I'd do well and have fun!   To boot, almost every menu is a scheme to get you to play more, to get armor sets, and to buy new cosmetics. I don't care about any of that. You boot the game and you are immediately overwhelmed by a deplorable amount of Valve Classic TF2 hat garbage nothing that has to do with learning or playing the game. It's just disappointing.  In fairness, this game is immensely complex, has robust levels of play, and a totally free roster (something all other mobas lack). Pro play is fantastic to watch and there's so many unique strategies to approach a match.  If you are a real human and don't have that much time to dedicate playing video games: Don't. Play. This. You will get stuck in a feedback loop sucking Valve's downstairs and ultimately shredding your life force away. For what? An intrinsic esoteric abstraction of a single mod for Warcraft 3. Stop while you still can. Get a girlfriend, get a job, get a skillset, and for the love of Christ go and play one of the thousands of unique titles out there right now. You will enjoy yourself more, I mean it sincerely. From a guy who has played thousands of hours of these types of games.","buruk"
"76561198051950822","stop wasting your time on any video game.. you only live once and life is way more than just having fun.. go seek for Jesus and will understand purpose and meaning of life","buruk"
"76561198124153487","nothing but smurfs now. Makes dota 2 unplayable and not fun. 10% of the games don't have smurfs and then it's enjoyable. pretty much done with dota2","buruk"
"76561198003081809","complete garbage , wish they wipe all the bullshit and crap they added.. the only moment this game was good was about the beta time.. no events , tl is dead , nothing but a cash grab","buruk"
"76561198064949939","This game is hell itself. If you want to see a batch/series/season full of shit players, please like this review so im motivated to start a twitch stream where i will show inbreds of the lowest kinds who try shit builds and are definitely in the wrong rank. Every single match will have unique piece of shits to witness.","buruk"
"76561198327118608","if you never play this game, please don't try it, it will take your life happiness, your purpose of life, and make your life so much worse. But, if you have tried this, the only thing that i can say is, welcome to the worse of your life. I hope, you can enjoy this game and STILL enjoy your life. I also hope that you can graduate from this game. But, in the positive way is, my friend's life was saved by this game. He can jump from the building and he already on top of the roof of the building. Suddenly, his friend invite him to play this game, then he cancel the plan and play this game. He's already graduate from this game.","buruk"
"76561198080683164","This game is garbage, you never know who your teammates are making it impossible to coordinate if you lose early in the game, you're most likely to lose late game the most toxic community, friends unfriend each other after a bad game, lose your wife because you're ""addicted and don't spend enough time with me"", lose your sense of self because 1 lost game can mess with your whole worldview. See you next game.","buruk"
"76561199445549632","I couldn't even play more than 5 minutes of a match against bots. The controls are really confusing and game itself doesn't attract me.","buruk"
"76561198856182653","[h1]Dota 2 – A Brutal Lesson in Frustration (from a LoL Veteran)[/h1]  With over 4000 hours in League of Legends, I thought I’d seen it all in the MOBA world. I expected Dota 2 to be hard, deep, maybe even rewarding in time. Instead, I found a game that actively hates new players.  [h2] Hero Design – Welcome to the Stun-Lock Hell[/h2] Dota 2 doesn’t teach you. It punishes you. • Enemies strike from fog with absurd range. • You're stunned before you see them. • You're deleted before you can blink. • There’s no counterplay, no outplay, no escape.  This isn't a learning curve – it’s a spike through your skull.  [h2] Thrown Into the Fire, Alone[/h2] I requested a coach. No one came. There’s no tutorial that actually helps. No guidance. No mentoring. You're tossed into matches with veterans who will tear you apart, and if you ask for help? Expect pings, flames, or silence.  Dota 2 doesn’t care if you’re learning. It just wants you to suffer or quit.  [h2] The Item System – Designed to Confuse, Not Enhance[/h2] • Active items with no visual clarity • Courier juggling like it’s StarCraft • Recipes that make zero sense • Mandatory outside research just to function  I spent more time alt-tabbing to Wikis than actually playing the game. At some point I asked myself: Is this even fun anymore?  [h2] Chaos Disguised as Depth[/h2] Early game? Slow and punishing. Mid game? Fog ganks and surprise deaths. Late game? Blink in, die instantly, stare at death screen.  I didn’t get better. I got numb and I couldn’t learn from my mistakes because I didn’t even understand what killed me.  It’s not ""deep gameplay."" It’s opaque and abusive game design.  [h2] Community – Gatekeeping on Steroids[/h2] • Ask a question? Get mocked. • Die once? ""Report noob."" • Try to play safe? ""Why u no help?""  This isn't a community. It's a fortress of elitism, and if you’re not already inside, you're just cannon fodder.","buruk"
"76561198161925549","Let me tell you the story of a game called dota 2.     Throughout the years jillion players have spent major time on this, so you might think it got better. Nope, trash games, trash matchmaking and trash ....    The TI prizes went from 40million USD to 2 million (THATS 95% DECREASE) also which should show you the trend this game is going over the years :)))    for your reference, a bachelor of engineering costs on average 6000 Hrs to complete. And Im angry to see so many people spend so much more than that on this significantly diminishing crap.     No offence to anyone, I respect you and want you to be more successful somewhere that your time gains value overtime not less. At this rate I would say Dota 2 server's would go down completely within the next 5 years. Lets thank valve for the great experience they gave us over the years and put this rotting game in the grave already.     ","buruk"
"76561198073970568","Since Dota 2 is against free speech and my ability to write into chat or communicate has been taken, im not going to play this game and buy Chests anymore until i will be able to communicate with apes in my team again.","buruk"
"76561198797489455","The most stupid and unbalanced game full with bugs, even after 10 years its again bugged. How can it not be bugged when they change it with each patch 70%, each time a new patch is released you play a new game, and first 3 months of the patch are full of bugs, I would not recommend playing this game at all DOTA 1 IS STILL MUCH BETTER AND BALANCED CHOICE","buruk"
"76561198046985405","The original game was good. With every update it gets worse and worse. Enemy team picks four carry's and gets dominated. Two people from their team leave. Suddenly the rest three get insane amount of gold. Eventually they win with about 10-15k networth above ours, while having 25 kills less.","buruk"
"76561198067129727","you managed to make great game into shi tty game like Leage of Legends, everything in dota is now same as in lol , skill gap is so big like i had a guy with score 0 22 on ranked! wtf are u doing","buruk"
"76561199123019954","horrible early game. smurfing, bullying, all of it. people specifically play this game to troll and enrage others. just continuously ruins your day","buruk"
"76561198126681981","Did I ever tell you what the definition of insanity is?  Insanity is doing the exact same thing over and over again and expecting different results","buruk"
"76561198180424361","after 2.5 k hrs i can say this game with damage your mantle health. and as if today i removed the game and never looking back.","buruk"
"76561198824488781","Game of shi*, for people  made out of shi*. Only acc buyers, smurfs e.t.c VALVE give 0 f about the game. Check any Dota 2 profile in mm 9 out of 10 accounts are with TROPHY lvl 35-60. And if you keep the research and go to dotabuff then you can clearly see that accounts are with like 200-500 games e.t.c  Overtwach system is absolute trash that been controlled buy braindead sub human beings, same as MMR system that exist since D2 launch with out any updates(So boosters acc sellers e.t.c can keep business running)   Lost 50% of it's players, but well who give a f  R.I.P Dota2","buruk"
"76561198082846733","Toxic match making, if you get some sort of win streaks you will almost always get set up for some loss streak to compensate, 4 games in a row, 1: pudge that can't hook stationary targets,2:lion that stun the ground next to target repeatedly 3: GG phonix that wont stop griefing and went afk at min 7,4: Alch pos one that bought first agh and used on his marci support","buruk"
"76561199595523936","If you have respect for your time & life as a human being : Delete this game immediately.  -matches are not coordinated at all maybe 1 in 10.  -players are so rude , mean , and childish.  -time investment that is needed for this game is equal to starting a successful business on your own.  -i have been a dru.g addict and i'm telling you : this game is one of the worst addictions in the world.  it drains your whole life energy from you,ruins your relationships and leave in a state of constant anger and hatred...  just delete.","buruk"
"76561199105592101","Trash game fucking unplayable the graphics were not budget friendly i cant run the game anymore fuck this dogshit game stay dead noob valve","buruk"
"76561198259719928","Dota 2 is the best game I’ve ever played in my life. And I’m not saying that lightly since I’ve got around 15k–20k hours in this game. The concept, the constant updates, the pro scene, the custom games… everything about Dota is incredible. But there’s one thing that matters more than all of that.  Matchmaking.  And unfortunately, Dota 2’s matchmaking system is so bad that you’ll consistently find yourself leaving games tilted, frustrated, or downright confused. It’s the one flaw that overshadows everything else this masterpiece has to offer.   So when asked. Would you recommend this game to others? My answer is No. Do not play this game. The it has been 6 years since my last review and no change.","buruk"
"76561198280442713","Thank you for ruining the game after the last ridiculous update. Bravo, you made me delete this game after 12 years! I don't recommend it to anyone who starting the game right now.","buruk"
"76561198060479609","A once legendary, but now abandoned and depressing game with no content updates. Instead of updating the stagnant gameplay, we got an ugly chest with poor quality sets. Developers don't care about their game at all, and we're all slowly watching it die.","buruk"
"76561199076478027","If you are worried about your mental health, I gotta warn ya, dota 2 community is toxic as HELL and Valve made it super easy for these toxic people to report you ""for no reason at all"".. yeah that's right. each player gets to report another, 6 times in each match. and it does not end at this point. admins who ban ya also dont know anything about roles. For example if pick a sup and the carry is too dumb to make the game a win, you CAN NOT act like a boss and stand up for kills. You gotta just move behind the dumbest core ever till enemy finishes the game in 60 mins. That is what this game has transformed to. A pool of toxicity that when you show creativity, they just throw you to LOW priority. NOW, what is low priority you may ask? Its a match unlike what you installed on your computer. in fact you kinda get to play another game. with only 3 heroes. its a game of chances that this toxic community LOOOOOVEEEES. I've been playing since dota 1. so more than your age probably. I recommend that you don't install this game until they fix the Behavior Score policy. it just ruins your day when you are super niceee and super creative and then coming back to your PC to play a game in which you payed $2000 of skins, and NOPE you can not play this game. you gotta play Single draft with the most stupid players on the surface of this planet till you win 5 matches. and you wont win for like 10 or 12 matches which takes 5 days of a normal human with a JOB ^_^ yeahh. Also the ranking system is super stupid. you just cant win a 1 v 9 game when you get the worst team mates who think of nothing but ruining your experience and revenge on ""why did you tell me to buy wards?"". as Gaben said, he does not care about our feedback. He just does what he wants to.","buruk"
"76561198209597772","This game makes no since in it's queue's the timer is fucking long. And even if u get a connection issue by mistake you have to wait 30 WHOLE FUCKING MINUTES before you can requeue, fuck you Valve if I wanted a shitty product with no reasoning to it's community I'll go play League of Legends","buruk"
"76561199772548184","Valve, in its infinite wisdom, hasn't figured out why even newer mobas have surpassed it. Here it is: when I know I've lost, I want to lose. Learning curve steep? That's fine. Make abandoning either player friendly or make surrendering an option. Ain't nobody got time for this sh*t of a game.","buruk"
"76561198814820550","unnecessary time waste for anyone trying to have a good time playing a game, specially if you're new to this game, rip if you're new to the moba genre, if this is your first online multiplayer please dont even bother, your first video game? Just dont play games, life can be enjoyed in many different ways.","buruk"
"76561198060835492","Play 2 games with a friend so he can teach me to play the game...    - win both games cause he carries  - get put in smurf queue and get destroyed ever since  - no chance for me to learn against people my level  - forced to play unbearable games where i just cant do anything because they abuse my lack of knowledege  - get flamed for being shit in ALL PICK games fck this community i thought this game might be better than league but the community is worse :DDDDDD hope this game dies off soon","buruk"
"76561198145670138","AVOID NOT NEW PLAYER FRIENDLY!!    Was enjoying the game as a new player in new player mode with my partner.  A few issues we have encountered however:  Some aspects of the game dont work such as season Dota Plus features.  Tutorial had bugs and couldn't complete certain tutorials.  Win/Loss/Commend game stat data didnt work.    Then we tried to play an Unranked game.    Turns out you can't pick the heroes you want as majority of them are banned - we tried this twice.  As a new player forced to play characters we havent been practicing with and unable to select the ones we had.  Then all of a sudden i have ""Matchmaking disabled due to excessive reports,failing to ready up , behaviour or abandoning..."" I had done nothing wrong..    This could have been a great game - but considering its over 10 years old - it has many bugs and issues -  NOT NEW PLAYER FRIENDLY!!  ","buruk"
"76561198328334174","This game genuinely changed my life for the worse. The moment i opened this game my mother was hit by a truck tire flying at 200km/h after a brutal accident. After she died, it turned out that she misspelled my name in the will and everything she left me was sent to a random person. After that, I sat down and tried to play the game, but my chair broke and i fell onto the floor. In anger, i threw my broken chair at a wall, which made my entire house collapse. Because my house collapsed, all my possessions were buried under the rubble and the only thing that remained was my PC setup. I tried to calm down by playing some Dark Souls III, but my steam library glitched and now the only game I can play is Overwatch 2. While I was playing, I got a phone call saying that I had been convicted for murder and was going to prison for life, because when I collapsed my house, the shock wave caused my neighbours cooking oil to tip onto his turned on gas stove, which blew him up immediately. When I got to prison, they said I was being sentenced to death, and asked for my last meal. I wanted a Big Mac no pickles, but McDonalds got the order wrong and gave me a cold McChicken with extra pickles. Don't trust the price tag on this game, it seems cheap but the cost is really much higher than the actual price tag. This game has ruined my life.","buruk"
