"SteamID","Ulasan","Status"
"76561199701415050","日本利用压电瓷砖将脚步转化为电能。这些瓷砖捕捉来自你脚步的动能。当你行走时, 你的重量和动作会对瓷砖产生压力。瓷砖会轻微弯曲,从而产生机械应力。瓷砖内部的压电材料将这种应 力转化为电能。每一步都会产生少量电荷,而数百万步结合在一起就能产生足够的电力来驱动LED灯、 数字显示屏和传感器。在像涩谷车站这样繁忙的地方,每天大约有250万个脚步为这一系统作出贡献。 这些电能可以被储存或立即使用,从而减少对传统电力来源的依赖,并支持可持续的城市基础设施。这种 方法将日常运动转化为实用的可再生能源。 #日本 #知识 #事实 #你知道吗 #推荐 #科技 #创新 #历史 #技术 #实验 #热门","baik"
"76561198051163539","The game is incredibly deep, constantly updated, and completely free. You get thousands of hours of content for the price of your sanity. The community is.. well, it's a Dota community. Mute button is your best friend. If you have a masochistic streak and a desire to master the most complex team-based strategy game ever made, welcome home. Just don't say I didn't warn you.","baik"
"76561198300921139","Amazing game, alot of characters to choose from great events and updates throughout the year. Interesting characters and brilliant cosmetics/items. Alot of fun to have with friends or solo.","baik"
"76561198254468634","That is a nice game in terms of improving reaction, prediction, logic and teamwork. Basically the best thing to play if CS2 doesnt reg.","baik"
"76561198361505502","Brutally unforgiving, but fun when you win. Zero sum game. it takes absurdly long to play ranked which is when the game really starts","baik"
"76561198060470987","complex thinking and strategy complete with strong team work although the community sometimes a little toxic as MOBA game usually does","baik"
"76561198159288189","DOTA 2 remains one of the most strategically complex and competitively balanced multiplayer games available, offering near-endless depth through its vast hero pool and dynamic itemization. The game’s constant updates and meta shifts keep both casual players and professionals engaged, ensuring that no strategy remains dominant for long. Its matchmaking system, while occasionally criticized, generally succeeds in creating challenging and rewarding games that test mechanical skill and strategic thinking. The esports scene surrounding DOTA 2 is exceptionally rich, featuring high-stakes tournaments like The International that showcase world-class talent and innovation. Overall, DOTA 2 stands out as a demanding yet deeply satisfying experience for players who appreciate mastery, teamwork, and ever-evolving tactical gameplay.","baik"
"76561198138552681","Regular updates, good balance, a consistent dark fantasy character style (unlike the Disney-esque visuals in other games), and a large community made up mostly of wealthy adults who play the game simply to relax and have a good time while interacting with people from all over the world.","baik"
"76561198086383688","Altough it takes a toll on your health by not allowing you to sleep for those midnight game sessions, Dota 2 is still a great game and I wholeheartedly recommend it to any MOBA fan.","baik"
"76561198093399192","Do not touch this game. Be happy. Enjoy life, nature, family, and friends. Go to a bar, ride a bike, go hiking, do anything else. This game will ruin your life and your relationships, and you will end up alone, anxious, and traumatized.  ","baik"
"76561198989509529","i highly recommend this game for someone who is struggling in life because it'll surely give you lots of things that will distract you to your problems. in fact this game is so fucked up you would end up attempting a suicide just for that 10 mmr","baik"
"76561198778245971","I'm actually a fan of MOBA games, dota 2 just hit different than the other's tbh. The lore, the hero mechanics, the whole game itself is quiet entertaining. Take note that this game is kinda addicting if you don't go out or something, this would be the end of you. Go touch some grass, find a partner, be happy and appreciate the world. Don't let this game get into you, and yes it's a very nice game.  PS: Playable even at bad spec's pc Will took almost an hour every game And yet after all of that just to lose a single match game. Still i like it.","baik"
"76561198305023512","Dota 2 is the only game where I queue happy, tilt in 5 minutes, dominate in 20, lose in 50, and still click “Play Again.” Every match feels different — sometimes you get teammates who play like pros, sometimes like they installed the game yesterday. Still fun tho.  The game is toxic, stressful, and mentally draining… But when you win? Pure happiness.  Free to play, no pay-to-win, tons of heroes, big brain plays, clutch moments, and the kind of chaos that keeps you coming back even when you swear you’re uninstalling.  If you want a game you’ll love and hate at the same time: This is the one.  Recommended.","baik"
"76561199248183464","Dota 2 — Strategy, Skill, and Endless Competition  Dota 2 isn’t just a MOBA it’s an intense, ever-evolving test of strategy, teamwork, and mechanical skill. From chaotic early-game skirmishes to high-stakes Roshan fights and decisive base sieges, every moment demands focus, adaptability, and split-second decision-making.  The hero roster is vast and diverse, with each character offering unique abilities, synergies, and counterplay. Mastering their skills, item builds, and positioning turns every match into a deep tactical battle where knowledge and execution are key. The constantly shifting meta keeps gameplay fresh, ensuring no two matches ever feel the same.  Teamwork is essential. Success relies on communication, coordination, and trust, making victories feel hard-earned and defeats push players to refine their skills. A perfectly timed combo or last-second escape can be as thrilling as it is satisfying.  Visually, Dota 2 strikes a balance between clarity and spectacle. Spells, ultimates, and team fights burst in vivid color, while the map’s design offers tactical depth. Sound effects and the soundtrack provide critical feedback, immersing players in the tension of every gank, push, and engagement.  [h3]Final Verdict:[/h3] Dota 2 is a pinnacle of competitive gaming — complex, challenging, and endlessly replayable. Every match is a story of strategy, skill, and teamwork that keeps players returning for more.  ""A battlefield where every decision counts, every hero has a role, and every victory is earned through skill and coordination.""  Overall Rating: ⭐⭐⭐⭐⭐⭐⭐⭐⭐⭐ 10/10","baik"
"76561198044585763","Best way to kill time or nerves depending on you`re desire , yet one of the best ESL Game there if you`re old school gamer , who has grown up with Frozen Throne","baik"
"76561199736367168","Gameplay drastically evolved since the first time I played. Uninstalled many times and forgot steam passwords 2 times. But here I am back playing. I became worse than I was before but hopefully I can get to my previous rank before the last time I quit.","baik"
"76561198088775807","It's good and fun, more people should play it. I played it in 2014, in 2015, in 2018, in 2022, and now in 2025. Probably about 700 hours. The game has gone through so many radical changes, but honestly I think all for the better. All the new systems like facets are very cool to me. This game also had one of the largest and best updates I've ever seen in a multiplayer game with the map expansion update.  This game is ""hard"" to get into, but I do think it's worth it, after you get the basics it can be a very chill game to play casually, in the way that it's not a fast paced high adrenaline twitch shooting reaction based game maybe some character can feel like that, but the game is mainly a cerebral game. Most of that mental work is done at the start as it becomes muscle memory after enough time and you don't even need to think about it. Like the timings of camps and objectives, day night cycle, items etc. Also yes the game is toxic, but that's not a dota problem.  That's when you can really enjoy Dota.","baik"
"76561198149355443","Best game I've ever played. Wish the community was a little more chill on average, but if you look hard and liberally use the mute button, you can find some gems.","baik"
"76561198217728067","This game is cool, have indepth mechanic yet easy to understand after you experiment a bit or watch some youtube guides, game also free BUT THIS GAME DEFINITELY COST YOU SANITY EACH TIME YOU HIT THAT FIND MATCH BUTTON","baik"
"76561198016759731","Been playing this for as long as i can remember. Its no longer the same as it was before but it is something new everytime. Cudos to devs who keeps coming up with new ideas to add to the game.","baik"
"76561198100791011","[h1] The Game of All Time [/h1]  If you want to learn how to control your anger, you need to play this game.  [spoiler] 10/10 [/spoiler]","baik"
"76561198049889343","Dota 2 is the most complicated game where I still havent mastered all heroes after playing for more than 10k plus hours...","baik"
"76561197990522786","Love the game, make sure to play with some friends if you can or make some friends in game as well","baik"
"76561198210072179","Dota 2 remains one of the most engaging and rewarding competitive games available today. With its large roster of heroes and countless strategic possibilities, every match feels fresh and exciting. One of the game’s strongest qualities is its balance, despite the huge variety of abilities and playstyles, the developers consistently manage to keep heroes competitively viable, allowing players to experiment without feeling limited. The gameplay is intense and challenging, but also incredibly fun.","baik"
"76561198143535423","⭐ Dota 2 – Game Review  Platform: PC Genre: MOBA (Multiplayer Online Battle Arena) Developer: Valve Release: 2013 (continuously updated)  🎮 Gameplay  Dota 2 is a deep, highly strategic 5v5 competitive game where teams fight to destroy the enemy Ancient. With over 120 unique heroes, item builds, talents, and complex mechanics, it offers endless replayability. Every match feels different because heroes interact in surprising ways, and teamwork is often the deciding factor.  The learning curve is infamously steep. New players often struggle with last-hitting, map awareness, and advanced mechanics like creep aggro or power runes. But once those click, the game becomes incredibly satisfying.  ⭐ What Dota 2 Does Exceptionally Well 1. Unmatched Depth & Complexity  It’s widely considered the most mechanically and strategically complex MOBA. No match feels scripted you constantly adapt.  2. High Skill Ceiling  Veterans love that mastery takes years. Knowledge matters as much as mechanics.  3. Beautiful, Polished Visuals  Valve’s Source 2 engine gives smooth animations, readable effects, and a clean UI.  4. Free-to-Play Done Right  Every hero is free. No pay-to-win. Cosmetic-only monetization (skins, couriers, terrain, etc.).  5. Massive eSports Scene  The International remains one of the biggest prize pool events in gaming. Watching pro matches is an experience itself.  ⚠️ Weaknesses 1. Very Steep Learning Curve  New players may feel overwhelmed and sometimes frustrated.  2. Toxicity  Team-based games + high stakes = sometimes rough player interactions.  3. Long Match Times  Matches last 30–60 minutes. No quick-play mode.  4. Balance Swings  Frequent patches keep the game fresh, but can make some heroes feel unbalanced.  🗺️ Community Experience  The player base is passionate and experienced, but sometimes intense. Dota 2 is best enjoyed with friends or a consistent group to reduce toxic encounters.  🏆 Overall Verdict  9/10 – A masterpiece of competitive gaming, but not for the faint of heart.  If you enjoy deeply strategic, team-based games with a high skill ceiling, Dota 2 is one of the most rewarding multiplayer titles ever made. If you prefer simpler or more relaxed gameplay, it may feel overwhelming.","baik"
"76561198036385985","Truly a great game. A lot of people say it's very difficult (which it is) but it's also a great game to play casually. There are in game guides that help new players just play the game instead of worrying about itemization. All of the characters are free, no need to worry about not liking a character and wasting your time or money. I'd say give it a shot. Dota respects you as the player and rewards you for putting in the time.","baik"
"76561198298976498","I left for a good year. (I had sex and touched grass) Thought to myself i may never come back...  But just like heroin, i cannot live without it. I guess am back again.  Whatever you do, never play this game.  10/10 - ""Help me please!!""","baik"
"76561199630148319","Even though you play the same scenario over and over again, no two games are exactly alike. This is a great strategy game and I've been playing this since 2007.","baik"
"76561198077485845","This is a legal drugs, once you use it once you get addicted to it and you knows its bad for you","baik"
"76561199256200986","This game has a super toxic community. Every match you go into, a bunch of clowns jump on you and start trash-talking you nonstop. Most of them are Russian, and honestly this game made me start disliking Russians. If you don’t want your mental health to get fucked, seriously stay away from this game.","baik"
"76561199544792786","your teammates communicate via discord but you're playing alone. you say ""buy wards"" and they will mute you and report you for toxic chat then your communication score will drop and you'll not be able to use chat. thx valve and good bye","baik"
"76561198298739907","It's like that one toxic ex you hate but still check up on their Instagram (The International).  Best game I will never play again.","baik"
"76561198331988749","Dota 2 is a cesspool where cheaters and whiners feel right at home. 1 out of 10 stars  If you're looking for hell but don't want to leave the comfort of your computer, welcome to Dota 2. This game has long since become less a contest of skill and more a competition of who has the best software and the strongest nerves.  Cheaters are the new masters of the cesspool.  Every other game is a lottery. Will your team win? No. The question is which side will have the player with the perfect Pudge hook prediction, who always knows where you stand in the fog of war, and whose couriers deliver items themselves. Scripts for instant disables, autocasts, and a map that shows all enemies are not rare exceptions, but the harsh reality.  Whiners are the soundtrack to the cesspool.  You've just logged into the game, and your mid laner has already died twice and is typing ""gg"" in the chat. Someone picked the wrong hero, someone didn't like your build, someone simply decided the game was already lost five minutes in. The entire match is a symphony of ping spam, insults in voice chat, and passive-aggressive text messages. Teamwork for victory? There's no such thing. There are five people, each convinced they're the lone genius on a team of asses, and everyone must obey them.  Bottom line:  Dota 2 is a digital cesspool where the developers can't (or won't) clean it up. It eats up your time and nerves, offering nothing in return except frustration and a scorched emotional wasteland. It's better to download another game, reread a book, or just stare at the wall. It'll be more productive and enjoyable.","baik"
"76561198053577661","You'll get matched against players with 12,000 games, you will lose and other players will blame you, report you and you will be muted.    edit: still true, months later","buruk"
"76561198105574266","Dota 2 currently has a significant prevalence of smurf accounts. Newly created accounts have become the preferred choice for smurfs, particularly those using nicknames with Chinese characters. Furthermore, several in-game features have not been updated, such as the Dota Plus quests and certain hero talents that are considered ineffective. A prime example is Crystal Maiden's talent that provides +225 attack speed.  Additionally, the process for reporting smurf accounts is notably slow, which contributes to the high number of smurfs in the game. This situation has made the game feel increasingly unfair and has diminished its overall enjoyment since the rise of smurfing.","buruk"
"76561199096229138","The game punishes new players. The lower your behavior score drops, the worse the people you are matched with. Anytime other players report you, even if its just for being inexperienced, you lose behavior points. The lower behavior points the other players have, the more they like to report. Its a never ending cycle where new players are stuck. I am new to games like this, and while I have begun to enjoy Dota for the gameplay, I am not the best at it. Even with over 100 hours I am still not the most talented player. The game makes you start out playing with random players of all ranks and skillsets so you are often matched with and against people who know more than you. Some are helpful and understanding, most are incredibly testy. They get angry over small mistakes, cuss, and rally others to start a reporting parade. If Dota changes their social credit system so it actually punishes people who are trolling, insulting, and abusing the game instead of punishing learning curves and the infrequent spotty internet error, I would recommend this game to most people.","buruk"
"76561198083256018","> trash matchmaking  > its like your mmr controlled by the system, so that you will get super addicted to this game  > after giving u winning streak with good team against super noob enemies, next it will pair u with trash team against good enemies  > its super rare to get balanced team  Conclusion? UNINSTALL! GOOD BYE DOTA 2 AFTER PLAYING IT SINCE 2013 T..T","buruk"
"76561198074370046","Waste of time, this is coming from someone that wasted 8k hours in this game. You get automatically convicted after x reports, nobody is reviewing the game you get reported for. You get let's say 3-4 times more commends than reports and you still get convicted. I saw how people bash the report button for no reason just because they tilt. In one instance I had a  russian streamer on my team, he took support chaos knight, I said ok, let me watch his stream. He literally was raging all game, he went 0-15, and he was mashing the report button on all team for everything. Saw him playing games the next few days. So for sure the behavior system is a good idea. So don't waste your time with this game. You will just rage and not enjoy anything. You get 200 behavior points for 15 games with commends and one conviction you get penalized with 1000 point, EVEN IF YOU DON'T write anything you don't ping nothing. How can you get penalized for communication when you are not writing or saying anything on voice. Their automatic system is insanely exploitable. So do yourself a favor play something that will bring you joy and a chill experience. This is not the game for that.","buruk"
"76561198068672291","For me it was just like the ex i couldn't move on from because i didn't think i could find better...imprisoned me for several years but i'm glad i could set myself free...","buruk"
"76561198027865591","Sold everything I could, it's not a game for anyone, as you need to deal with toxic people all the time, and the game don't know how to filter it properly.... Can't pair the level of the players too........ Bye bye","buruk"
"76561198120223786","Negative Review of Dota 2    Dota 2 is one of the most overrated and toxic games I have ever encountered. Despite years of existence and Valve’s enormous resources, the game remains incredibly frustrating, mentally exhausting, and often unfair in every possible way.    1. Terrible Community  One of the main reasons people quit Dota 2 is its community. It is truly toxic: in almost every game, there is at least one player who either deliberately ruins the match or insults the entire team. The report system is practically useless—griefers and toxic players go unpunished, while you can get muted just for asking your team to play cooperatively.    2. Extremely High Learning Curve  Even if you want to learn the game, are willing to invest time, and try to understand the mechanics, Dota 2 doesn’t make it easy for you. There is no proper tutorial, and the sheer amount of information you need to memorize is overwhelming. Moreover, even if you become a skilled player, that doesn’t mean you’ll win—too much depends on teammates and pure luck.    3. Balance is a Myth  Heroes are either too strong or completely useless. Every patch shifts the meta so drastically that you have to relearn everything. Some heroes stay unplayable for months, making it pointless to invest time mastering them, as they may become irrelevant in just a couple of updates.    4. Matchmaking is a Lottery  The ranking system in Dota 2 is another source of frustration. Matchmaking works in such a way that sometimes you get a team that plays perfectly, and sometimes you get players who have no understanding of the game’s basics. There is no balance between teams, and your wins or losses are more dependent on luck than skill.    5. A Waste of Time  To make any real progress, you need to invest hundreds of hours, yet even after that, you won’t necessarily enjoy the game. Every match is either stressful or disappointing, and the feeling of satisfaction is extremely rare.    Conclusion  Dota 2 may seem interesting at first, but in reality, it drains your time, nerves, and energy. It is a game for those who are willing to endure toxicity, unbalanced mechanics, and frustration. If you’re looking for fun, it’s best to stay far away from this chaos.","buruk"
"76561198085638478","7000 hours on record. Great game, but the 20% of people that play it have mental disorders. Very toxic, bad matchmaking system, get reported for in game mistakes.  Deleted the game today, after 3 games in a row with horrible temamates, I am done, glhf yall, I can have more fun in other games","buruk"
"76561199808351855","Matchmaking system is just awful.  Add to that every game has a troll griefing/suiciding or a permanent disconnect, and it makes for just a terrible experience.","buruk"
"76561197999924704","Over 3K hours on the game. I can say without a doubt this game has ruined more lives than any war in the middle east..... If you want something that you are completely powerless over being successful for then this is the game for you!!! Like wasting TONS of time to be griefed by your team? Then This is the game for you!! Like playing cheaters? Then this is the game for you!!! Like being paired with the lowest IQ people on planet earth that leaves you wonder how did they manage to even turn the PC on, this this is the game for you!!! they will NEVER do anything about smurf accounts and there is NO punishment for those that feed in ranked matches.....  THIS GAME IS THE BIGGEST PIECE OF TRASH TO EVER HAVE BEEN CREATED !!!!!! PREDATORY to say the least... DO YOURSELF A FAVOR RUN!!!!! RUNNNN FAR AWAY FROM THIS GAME !!!!!!!!!","buruk"
"76561198082929505","Game is ruined due to account buyers, players buying divine/immortal accounts to come into high tier ranked games and playing horribly and not get punished for it. Running into 6kmmr - 6.5kmmr with less than 600 games and cant do basic gameplay (i.e warding/blocking & unblocking camps, not buying blink as a pos 3 initiator, refusing to buy bkb as pos 1),  Instead you get reported and punished for telling them how to play properly. Dead game from 2020 onwards, avoid the headache from randoms thinking its a farm fest MOBA like LoL or MLBB, the player base isnt as smart as it was from the 2015 - 2019 era.","buruk"
"76561198064517173","Been playing this game for about 6 years now. Great game. However recently they have decided to report chat and ban chat privileges unfairly with no possible way to come back from it. Haven't been able to chat or talk in game for months now with no end in sight. I just play the game and get commended in some random games. Very upsetting being a long term player of this game. Not cool to ban chat just because someone can click a button even if you don't talk or chat. Do BETTER.  **Update - 1/7/26 - Still no chat privileges. been playing less and less, cant communicate, tm8s think I am being rude not responding or telling them what is happening. This game has really fallen off.","buruk"
"76561198052098632","I played  this game 2913 hours. if i used this time to French, i was an acedemician in Sourborne University. So stop playing and learn a language instead.","buruk"
"76561198084157542","fucking trash game. too many smurfs , too many cheaters ,matching making are so trash, after u win 1 game next game full of smurfs. ty dota 2 many player already quit this game because of that and they know u will never fix it. dont play this game if u just want to play for fun smurfs are everywhere red days is always coming. and those trash players feeling strong always saying the problem is not the smurfs. then play it alone :D","buruk"
